monthly_rent,category_id,property_type,rooms,bathroom,size,furnished,facilities,additional_facilities,address,state,region,publishedDatetime,ads_id,latitude,longitude
"RM 1,900 per month","Apartment / Condominium, For rent",Service Residence,3,2,900 sq.ft.,Not Furnished,"Parking, Jogging Track, Playground, Swimming Pool, Lift, Gymnasium, Barbeque area",,"Jalan PJU 8/8, Damansara Perdana, Selangor",Selangor,Damansara Perdana,2025-01-25 17:26,109236761,3.166047096464366,101.61157366364908
"RM 1,300 per month","Apartment / Condominium, For rent",Service Residence,1,1,600 sq.ft.,Partially Furnished,"Jogging Track, Multipurpose hall, Minimart, Gymnasium, Lift, Parking, Playground, Security, Swimming Pool, Barbeque area",,"Jalan Bukit Aliff Utama, Taman Damansara Aliff, Tampoi, Johor",Johor,Tampoi,2025-01-25 17:26,109925681,,
"RM 1,799 per month","Apartment / Condominium, For rent",Service Residence,2,1,589 sq.ft.,Fully Furnished,"Jogging Track, Multipurpose hall, Minimart, Gymnasium, Lift, Parking, Playground, Security, Swimming Pool, Barbeque area","Air-Cond, Cooking Allowed, Washing Machine","Jalan Bukit Aliff Utama, Taman Damansara Aliff, Tampoi, Johor",Johor,Tampoi,2025-01-25 17:26,109925680,,
"RM 1,000 per month","Apartment / Condominium, For rent",Apartment,3,2,950 sq.ft.,Not Furnished,"Parking, Security, Playground, Lift","Near KTM/LRT, Cooking Allowed","Off Persiaran Bandar Senawang, Taman Bandar Senawang, Seremban, Negeri Sembilan",Negeri Sembilan,Seremban,2025-01-25 17:25,109925678,,
"RM 1,300 per month","House, For rent",2-storey Terraced House,4,3,1500 sq.ft.,Partially Furnished,"Security, Gymnasium, Minimart, Playground",Cooking Allowed,,Selangor,Bandar Puteri Klang,2025-01-25 17:25,109925519,,
"RM 1,300 per month","Apartment / Condominium, For rent",Condominium,1,1,350 sq.ft.,Fully Furnished,"Lift, Barbeque area, Jogging Track, Parking, Gymnasium, Security, Playground, Swimming Pool, Sauna",,"Jalan Sungai Tiram 6,  Ideal Vision Park, Bayan Lepas, Penang",Penang,Bayan Lepas,2025-01-25 17:25,109925541,,
RM 850 per month,"Apartment / Condominium, For rent",Flat,2,1,700 sq.ft.,Partially Furnished,,,"Lebuh Bukit Jambul, Bukit Jambul, Penang",Penang,Bukit Jambul,2025-01-25 17:25,109925539,5.344527971013673,100.29171946861103
RM 600 per month,"Apartment / Condominium, For rent",Flat,3,1,850 sq.ft.,Not Furnished,"Parking, Playground",,"Off Jalan S2 G1, Garden Avenue, Seremban, Negeri Sembilan",Negeri Sembilan,Seremban,2025-01-25 17:25,109925538,,
"RM 1,500 per month","Apartment / Condominium, For rent",Condominium,3,2,1080 sq.ft.,Partially Furnished,"Security, Playground, Gymnasium, Parking, Swimming Pool, Jogging Track, Lift",Air-Cond," Lorong Palm Square 12, Kinarut, Papar, Sabah",Sabah,Papar,2025-01-25 17:25,109925542,5.830986862882559,116.04365228694017
"RM 1,700 per month","Apartment / Condominium, For rent",Service Residence,1,1,500 sq.ft.,Partially Furnished,"Parking, Playground, Security, Swimming Pool, Lift, Gymnasium, Barbeque area, Club house, Jogging Track","Air-Cond, Cooking Allowed","Jalan Indah 25/2, Taman Bukit Indah 2 , Iskandar Puteri, Johor",Johor,Iskandar Puteri,2025-01-25 17:24,109379889,1.468932374435261,103.6519051063316
RM 650 per month,"House, For rent",Semi-Detached House,3,2,1200 sq.ft.,Not Furnished,Parking,"Air-Cond, Cooking Allowed",,Terengganu,Kuala Terengganu,2025-01-25 17:24,109925663,,
RM 800 per month,"House, For rent",Terraced House,3,2,2065 sq.ft.,Not Furnished,"Playground, Minimart",,,Selangor,Telok Panglima Garang,2025-01-25 17:24,109925660,,
"RM 1,100 per month","Apartment / Condominium, For rent",Service Residence,1,1,502 sq.ft.,Partially Furnished,"Parking, Security, Lift, Swimming Pool, Playground, Gymnasium, Club house, Jogging Track, Multipurpose hall, Minimart","Air-Cond, Cooking Allowed","Jalan Setia Murni U13/51, Setia Alam, Selangor",Selangor,Setia Alam,2025-01-25 17:23,109925656,3.1188307039333805,101.45292025158282
"RM 2,200 per month","Apartment / Condominium, For rent",Service Residence,3,2,820 sq.ft.,Fully Furnished,"Lift, Gymnasium, Jogging Track, Playground, Swimming Pool, Barbeque area, Parking, Security","Air-Cond, Cooking Allowed, Near KTM/LRT, Washing Machine","Jalan 9/142, Taman Connaught, Cheras, Kuala Lumpur",Kuala Lumpur,Cheras,2025-01-25 17:23,109925654,,
"RM 2,500 per month","Apartment / Condominium, For rent",Condominium,3,2,1020 sq.ft.,Fully Furnished,"Tennis Court, Club house, Parking, Swimming Pool, Gymnasium, Lift, Security, Playground, Squash Court, Multipurpose hall, Sauna, Barbeque area, Minimart, Jogging Track","Air-Cond, Internet, Cooking Allowed, Near KTM/LRT, Washing Machine","Off Persiaran Byan Indah, Bayan Lepas, Penang",Penang,Bayan Lepas,2025-01-25 17:22,109925650,,
"RM 2,000 per month","Apartment / Condominium, For rent",Service Residence,2,2,800 sq.ft.,Fully Furnished,"Swimming Pool, Lift, Security, Parking, Gymnasium",,"Jalan Medini Utara 1, Iskandar Puteri, Johor",Johor,Iskandar Puteri,2025-01-25 17:22,109925648,1.4305143484431648,103.63011171381208
"RM 1,600 per month","Apartment / Condominium, For rent",Apartment,3,2,986 sq.ft.,Partially Furnished,"Swimming Pool, Multipurpose hall, Playground, Gymnasium, Parking, Security, Lift",,"Jalan 7, Off Jalan Amaniah Mulia 5, Taman Amaniah Mulia, Batu Caves, Selangor",Selangor,Batu Caves,2025-01-25 17:22,109727524,,
"RM 6,000 per month","House, For rent",Bungalow House,6,5,5000 sq.ft.,Fully Furnished,"Parking, Security, Lift, Swimming Pool, Playground, Multipurpose hall, Club house, Jogging Track, Sauna, Gymnasium","Air-Cond, Internet, Cooking Allowed, Washing Machine",,Selangor,Puchong,2025-01-25 17:21,108408121,,
"RM 2,150 per month","Apartment / Condominium, For rent",Service Residence,3,2,864 sq.ft.,Fully Furnished,"Barbeque area, Parking, Security, Gymnasium, Swimming Pool",,"Jalan Atmosphere Utama 2, Off Jalan Putra Permai, Seri Kembangan, Selangor",Selangor,Seri Kembangan,2025-01-25 17:21,109867477,,
"RM 2,400 per month","Apartment / Condominium, For rent",Condominium,1,1,678 sq.ft.,Fully Furnished,"Lift, Parking, Security, Playground, Gymnasium, Swimming Pool, Barbeque area, Minimart, Tennis Court",,"Off Lebuh Laksamana, Puteri Harbour, Iskandar Puteri, Johor",Johor,Iskandar Puteri,2025-01-25 17:21,109925642,,
"RM 1,300 per month","Apartment / Condominium, For rent",Service Residence,1,1,600 sq.ft.,Fully Furnished,"Security, Parking, Gymnasium, Jogging Track, Playground, Lift, Minimart, Swimming Pool, Tennis Court, Sauna, Multipurpose hall",,"Jalan Mutiara Emas 9/23, Taman Mount Austin, Johor Bahru, Johor",Johor,Johor Bahru,2025-01-25 17:21,109925640,1.5472139532473548,103.78789878770715
RM 950 per month,"Apartment / Condominium, For rent",Apartment,3,2,760 sq.ft.,Partially Furnished,"Parking, Security",,"Jalan M, Kampung Tasik Permai, Ampang, Kuala Lumpur",Kuala Lumpur,Ampang,2025-01-25 17:19,109795000,,
RM 700 per month,"House, For rent",1-storey Terraced House,3,2,1200 sq.ft.,Not Furnished,,,,Perak,Chemor,2025-01-25 17:18,109925597,,
"RM 1,800 per month","House, For rent",Townhouse,3,2,1000 sq.ft.,Partially Furnished,"Parking, Security","Air-Cond, Cooking Allowed, Near KTM/LRT, Washing Machine",,Penang,Batu Kawan,2025-01-25 17:17,109731604,,
RM 700 per month,"House, For rent",Others,3,2,100 sq.ft.,Not Furnished,,,,Terengganu,Kuala Nerus,2025-01-25 17:17,109925586,,
"RM 1,700 per month","Apartment / Condominium, For rent",Service Residence,3,2,883 sq.ft.,Fully Furnished,"Security, Lift, Sauna, Parking, Playground, Gymnasium, Swimming Pool, Jogging Track, Barbeque area, Multipurpose hall","Air-Cond, Cooking Allowed, Near KTM/LRT, Washing Machine","Lebuhraya Bandar Cassia, Batu Kawan, Penang",Penang,Batu Kawan,2025-01-25 17:17,109780727,5.237960493379715,100.44254461590995
"RM 2,200 per month","Apartment / Condominium, For rent",Service Residence,4,3,1044 sq.ft.,Fully Furnished,"Security, Jogging Track, Gymnasium, Barbeque area, Sauna, Multipurpose hall, Playground, Lift, Parking, Swimming Pool","Air-Cond, Cooking Allowed, Near KTM/LRT, Washing Machine","Lebuhraya Bandar Cassia, Batu Kawan, Penang",Penang,Batu Kawan,2025-01-25 17:17,109711483,5.237960493379715,100.44254461590995
"RM 1,500 per month","Apartment / Condominium, For rent",Service Residence,2,2,667 sq.ft.,Fully Furnished,"Swimming Pool, Jogging Track, Security, Lift, Playground, Barbeque area, Sauna, Parking, Gymnasium, Multipurpose hall","Air-Cond, Cooking Allowed, Near KTM/LRT, Washing Machine","Lebuhraya Bandar Cassia, Batu Kawan, Penang",Penang,Batu Kawan,2025-01-25 17:17,109690284,5.237960493379715,100.44254461590995
RM 500 per month,"House, For rent",Terraced House,3,2,1000 sq.ft.,Not Furnished,Parking,Cooking Allowed,,Terengganu,Besut,2025-01-25 17:17,109925571,,
"RM 1,600 per month","Apartment / Condominium, For rent",Condominium,3,2,850 sq.ft.,Partially Furnished,"Parking, Security, Playground, Lift, Swimming Pool, Barbeque area, Multipurpose hall","Air-Cond, Cooking Allowed","Jalan Duta Kiara, Segambut, Kuala Lumpur",Kuala Lumpur,Segambut,2025-01-25 17:17,109925568,3.174307888083121,101.66263919884254
RM 900 per month,"Apartment / Condominium, For rent",Apartment,3,2,800 sq.ft.,Partially Furnished,"Parking, Security, Playground","Cooking Allowed, Near KTM/LRT","Jalan Bandar Puchong Jaya, Bandar Puchong Jaya, Puchong, Selangor",Selangor,Puchong,2025-01-25 17:15,108982241,3.056457333923685,101.6216517964334
"RM 2,700 per month","House, For rent",2-storey Terraced House,4,4,2300 sq.ft.,Not Furnished,"Parking, Security, Playground",Cooking Allowed,,Selangor,Setia Alam,2025-01-25 17:15,109925399,,
"RM 1,500 per month","House, For rent",Terraced House,3,2,950 sq.ft.,Fully Furnished,,"Air-Cond, Cooking Allowed, Washing Machine",,Selangor,Shah Alam,2025-01-25 17:11,108966162,,
"RM 4,200 per month","House, For rent",Semi-Detached House,5,5,3000 sq.ft.,Fully Furnished,"Parking, Security","Air-Cond, Cooking Allowed, Washing Machine",,Selangor,Shah Alam,2025-01-25 17:11,107949203,,
"RM 1,900 per month","Apartment / Condominium, For rent",Condominium,2,2,1050 sq.ft.,Fully Furnished,"Swimming Pool, Parking, Security, Barbeque area, Gymnasium, Lift","Air-Cond, Cooking Allowed, Washing Machine","Jalan Boling Padang 13/62, Seksyen 13, Shah Alam, Selangor",Selangor,Shah Alam,2025-01-25 17:11,108945837,3.0751843823612655,101.55101583371984
"RM 2,400 per month","Apartment / Condominium, For rent",Service Residence,4,2,1250 sq.ft.,Partially Furnished,"Playground, Swimming Pool, Lift, Parking, Security, Barbeque area, Multipurpose hall, Gymnasium, Minimart","Cooking Allowed, Air-Cond","Jalan Akuatik 13/64A, Seksyen 13, Shah Alam, Selangor",Selangor,Shah Alam,2025-01-25 17:11,109733476,3.078268230784844,101.54296069241275
"RM 1,450 per month","Apartment / Condominium, For rent",Apartment,3,2,785 sq.ft.,Fully Furnished,"Security, Sauna, Parking, Playground","Washing Machine, Cooking Allowed","Jalan Sastera U2/1, Seksyen U2, Taman TTDI Jaya, Shah Alam, Selangor",Selangor,Shah Alam,2025-01-25 17:11,109925491,,
"RM 2,600 per month","House, For rent",2-storey Terraced House,4,4,1800 sq.ft.,Fully Furnished,"Security, Playground","Air-Cond, Cooking Allowed, Washing Machine",,Negeri Sembilan,Port Dickson,2025-01-25 17:10,109925346,,
"RM 1,600 per month","Apartment / Condominium, For rent",Condominium,3,2,998 sq.ft.,Not Furnished,"Swimming Pool, Parking, Security, Lift, Tennis Court, Barbeque area, Sauna, Multipurpose hall, Gymnasium, Playground","Air-Cond, Cooking Allowed","Jalan Juara, Bandar Damai Perdana, Cheras, Selangor",Selangor,Cheras,2025-01-25 17:10,109925386,3.0376778499999997,101.73286744999999
"RM 1,000 per month","Apartment / Condominium, For rent",Service Residence,1,1,650 sq.ft.,Partially Furnished,"Parking, Security, Lift, Swimming Pool, Playground, Gymnasium, Sauna, Barbeque area, Minimart, Multipurpose hall, Club house, Jogging Track, Tennis Court, Squash Court","Air-Cond, Cooking Allowed, Near KTM/LRT, Washing Machine, Internet","Persiaran Bestari, Cyber 11, Cyberjaya, Selangor",Selangor,Cyberjaya,2025-01-25 17:10,109925334,2.9303384866516633,101.63825619529845
"RM 1,200 per month","Apartment / Condominium, For rent",Apartment,3,2,850 sq.ft.,Not Furnished,"Parking, Security, Lift","Cooking Allowed, Near KTM/LRT",,Selangor,Ampang,2025-01-25 17:10,109925327,,
"RM 3,200 per month","Apartment / Condominium, For rent",Condominium,3,3,1428 sq.ft.,Fully Furnished,"Parking, Swimming Pool, Jogging Track, Lift, Sauna, Security, Playground, Gymnasium, Barbeque area, Multipurpose hall",,"No.9, Jalan Persiaran Selatan, Horizon Hills, Iskandar Puteri, Johor",Johor,Iskandar Puteri,2025-01-25 17:10,109925313,1.4476983267769397,103.62909793523664
"RM 1,700 per month","Apartment / Condominium, For rent",Service Residence,1,1,653 sq.ft.,Fully Furnished,"Swimming Pool, Gymnasium, Parking, Security, Playground, Lift, Sauna","Air-Cond, Cooking Allowed, Washing Machine, Internet","Jalan Segambut, Segambut, Kuala Lumpur",Kuala Lumpur,Segambut,2025-01-25 17:09,109925467,3.1840363969332834,101.67237016686833
"RM 2,500 per month","Apartment / Condominium, For rent",Condominium,3,2,1050 sq.ft.,Fully Furnished,"Barbeque area, Squash Court, Sauna, Playground, Security, Gymnasium, Multipurpose hall, Club house, Swimming Pool, Jogging Track, Lift, Parking","Air-Cond, Cooking Allowed, Washing Machine","Jalan Dato Keramat, Georgetown, Penang",Penang,Georgetown,2025-01-25 17:08,109755640,,
"RM 1,500 per month","Apartment / Condominium, For rent",Condominium,3,2,1100 sq.ft.,Partially Furnished,"Parking, Security, Lift, Swimming Pool, Playground, Gymnasium, Sauna, Barbeque area, Minimart, Jogging Track, Tennis Court","Air-Cond, Cooking Allowed, Near KTM/LRT, Washing Machine","Jalan Pelangi, Off Jalan Batu Tiga Lama, Klang, Selangor",Selangor,Klang,2025-01-25 17:08,109925457,,
"RM 1,200 per month","Apartment / Condominium, For rent",Apartment,3,2,700 sq.ft.,Fully Furnished,"Parking, Gymnasium, Security, Barbeque area, Minimart, Playground",,"Solok Thean Tek, Off Lebuhraya Thean Teik, Ayer Itam, Penang",Penang,Ayer Itam,2025-01-25 17:08,109925456,,
"RM 1,000 per month","Apartment / Condominium, For rent",Apartment,3,2,850 sq.ft.,Partially Furnished,"Parking, Jogging Track, Security, Playground","Air-Cond, Cooking Allowed, Near KTM/LRT","Jalan Seroja, 25, Taman Dahlia, Bandar Baru Salak Tinggi, Sepang, Selangor",Selangor,Sepang,2025-01-25 17:07,109925451,,
"RM 2,500 per month","House, For rent",2-storey Terraced House,4,3,1400 sq.ft.,Fully Furnished,,,,Johor,Iskandar Puteri,2025-01-25 17:06,109925440,,
RM 800 per month,"Apartment / Condominium, For rent",Apartment,3,2,860 sq.ft.,Not Furnished,"Security, Parking, Playground, Swimming Pool, Gymnasium, Lift, Minimart, Jogging Track, Barbeque area, Multipurpose hall",,"Jalan Ecohill 1/2, Semenyih, Selangor",Selangor,Semenyih,2025-01-25 17:05,107665180,2.922125395535554,101.84731789567337
"RM 2,500 per month","Apartment / Condominium, For rent",Condominium,2,2,815 sq.ft.,Fully Furnished,"Parking, Playground, Lift, Gymnasium, Security, Swimming Pool, Barbeque area, Sauna",,"Off Jalan Datuk Bandar Mustapha, Richmond Hill, Kuching, Sarawak",Sarawak,Kuching,2025-01-25 17:05,109925286,,
"RM 1,000 per month","Apartment / Condominium, For rent",Service Residence,1,1,310 sq.ft.,Fully Furnished,"Parking, Security, Gymnasium, Swimming Pool","Cooking Allowed, Air-Cond, Washing Machine","Persiaran Cassia Barat 3, Bandar Cassia, Batu Kawan, Penang",Penang,Batu Kawan,2025-01-25 17:05,109925281,5.241042966996667,100.44114854926575
"RM 2,300 per month","Apartment / Condominium, For rent",Condominium,2,2,991 sq.ft.,Partially Furnished,"Swimming Pool, Multipurpose hall, Playground, Barbeque area, Security, Club house, Parking",,"Jalan 3/27E, Seksyen 10 Wangsa Maju, Wangsa Maju, Kuala Lumpur",Kuala Lumpur,Wangsa Maju,2025-01-25 17:05,109925276,3.188337700980591,101.73642723422486
"RM 3,500 per month","Apartment / Condominium, For rent",Service Residence,3,2,1357 sq.ft.,Partially Furnished,"Playground, Gymnasium, Multipurpose hall, Security, Sauna, Swimming Pool",,"Jalan Bersatu, Damai, Kota Kinabalu, Sabah",Sabah,Kota Kinabalu,2025-01-25 17:02,109925420,5.966792148249591,116.0966616035008
RM 650 per month,"House, For rent",1-storey Terraced House,3,2,2600 sq.ft.,Not Furnished,"Parking, Playground, Minimart, Jogging Track","Air-Cond, Cooking Allowed, Near KTM/LRT, Washing Machine, Internet",,Perak,Sungai Siput,2025-01-25 17:01,109298075,,
"RM 1,500 per month","Apartment / Condominium, For rent",Service Residence,3,2,870 sq.ft.,Partially Furnished,"Swimming Pool, Parking, Gymnasium, Jogging Track, Security, Minimart, Multipurpose hall, Playground, Lift, Sauna","Air-Cond, Cooking Allowed","Jalan Nountun, Kota Kinabalu, Sabah",Sabah,Kota Kinabalu,2025-01-25 17:01,109925408,5.991875769356827,116.13480244617114
"RM 4,000 per month","Apartment / Condominium, For rent",Condominium,3,2,980 sq.ft.,Fully Furnished,"Sauna, Security, Swimming Pool, Parking, Gymnasium, Lift",,"Jalan Eko Botani 3/5, Eco Botanic City, Johor Bahru, Johor",Johor,Johor Bahru,2025-01-25 17:01,109925403,,
"RM 1,150 per month","Apartment / Condominium, For rent",Condominium,3,2,1000 sq.ft.,Partially Furnished,"Lift, Gymnasium, Parking, Playground, Multipurpose hall, Security, Barbeque area, Swimming Pool, Jogging Track",Cooking Allowed,"Jalan Semenyih, Semenyih, Selangor",Selangor,Semenyih,2025-01-25 17:00,108820124,2.9591273103196403,101.83954419725188
"RM 2,300 per month","House, For rent",2-storey Terraced House,4,4,2364 sq.ft.,Partially Furnished,"Parking, Security, Playground, Jogging Track",,,Selangor,Setia Alam,2025-01-25 17:00,109914985,,
"RM 2,800 per month","House, For rent",2-storey Terraced House,4,4,2360 sq.ft.,Partially Furnished,"Parking, Security, Playground, Jogging Track",Air-Cond,,Selangor,Setia Alam,2025-01-25 17:00,109914850,,
RM 700 per month,"House, For rent",1-storey Terraced House,3,2,1430 sq.ft.,Not Furnished,"Parking, Playground, Jogging Track",,,Johor,Kluang,2025-01-25 16:58,109925355,,
"RM 1,800 per month","House, For rent",2-storey Terraced House,4,3,1500 sq.ft.,Fully Furnished,Parking,"Air-Cond, Cooking Allowed, Washing Machine",,Melaka,Cheng,2025-01-25 16:58,109925347,,
"RM 1,400 per month","House, For rent",Terraced House,4,4,2400 sq.ft.,Partially Furnished,,"Air-Cond, Cooking Allowed",,Negeri Sembilan,Seremban 2,2025-01-25 16:55,109018845,,
RM 850 per month,"House, For rent",1-storey Terraced House,3,2,1400 sq.ft.,Partially Furnished,,,,Kedah,Sungai Petani,2025-01-25 16:55,109925182,,
"RM 1,600 per month","Apartment / Condominium, For rent",Apartment,3,2,850 sq.ft.,Partially Furnished,"Playground, Gymnasium, Parking, Security, Swimming Pool, Lift, Multipurpose hall, Jogging Track","Cooking Allowed, Near KTM/LRT","Jalan Danau Saujana 1, Taman Danau Kota, Setapak, Kuala Lumpur",Kuala Lumpur,Setapak,2025-01-25 16:53,109281593,3.2015430522313166,101.71456554774143
"RM 1,100 per month","Apartment / Condominium, For rent",Service Residence,1,1,598 sq.ft.,Partially Furnished,"Parking, Playground, Security, Gymnasium, Minimart, Jogging Track","Air-Cond, Cooking Allowed, Near KTM/LRT, Washing Machine, Internet","Off Persiaran Dato Menteri, Vista Alam, Seksyen 14, Shah Alam, Selangor",Selangor,Shah Alam,2025-01-25 16:52,60344048,,
"RM 4,100 per month","Apartment / Condominium, For rent",Condominium,3,2,1347 sq.ft.,Fully Furnished,"Parking, Lift, Minimart, Playground, Swimming Pool, Sauna, Security, Gymnasium, Multipurpose hall",,"Jalan Tengku Azizah, Bukit Chagar, Johor Bahru, Johor",Johor,Johor Bahru,2025-01-25 16:50,109925274,1.4660804421910185,103.76485714263775
RM 620 per month,"Apartment / Condominium, For rent",Condominium,1,1,250 sq.ft.,Fully Furnished,"Parking, Security, Gymnasium, Jogging Track, Barbeque area, Playground, Swimming Pool, Lift, Multipurpose hall","Cooking Allowed, Washing Machine, Air-Cond","Persiaran Cassia Barat 6, Bandar Cassia, Batu Kawan, Penang",Penang,Batu Kawan,2025-01-25 16:50,109574558,5.23660974338571,100.4332651109698
"RM 2,800 per month","Apartment / Condominium, For rent",Condominium,2,2,865 sq.ft.,Fully Furnished,"Parking, Security, Lift, Swimming Pool, Playground, Gymnasium, Sauna, Barbeque area, Minimart, Multipurpose hall, Club house, Jogging Track","Air-Cond, Cooking Allowed, Near KTM/LRT, Washing Machine","Jalan PJU 10/1, Damansara Damai, Damansara Damai, Selangor",Selangor,Damansara Damai,2025-01-25 16:50,109925268,3.1927615142771675,101.59322801828404
"RM 1,100 per month","Apartment / Condominium, For rent",Service Residence,1,1,410 sq.ft.,Fully Furnished,"Security, Parking, Gymnasium, Swimming Pool","Air-Cond, Washing Machine, Cooking Allowed","Persiaran Cassia Barat 3, Bandar Cassia, Batu Kawan, Penang",Penang,Batu Kawan,2025-01-25 16:50,109798364,5.239692676650539,100.43292654955665
"RM 1,600 per month","Apartment / Condominium, For rent",Service Residence,2,1,750 sq.ft.,Fully Furnished,"Multipurpose hall, Parking, Gymnasium, Sauna, Security, Playground, Club house, Swimming Pool, Lift, Barbeque area",,"Jalan Chain Ferry, Kampung Perlis, Butterworth, Penang",Penang,Butterworth,2025-01-25 16:50,109925266,,
"RM 1,100 per month","Apartment / Condominium, For rent",Service Residence,1,1,410 sq.ft.,Fully Furnished,"Gymnasium, Swimming Pool, Parking, Security","Air-Cond, Cooking Allowed, Washing Machine","Persiaran Cassia Barat 3, Bandar Cassia, Batu Kawan, Penang",Penang,Batu Kawan,2025-01-25 16:50,109904860,5.239692676650539,100.43292654955665
"RM 3,800 per month","Apartment / Condominium, For rent",Condominium,4,3,1227 sq.ft.,Fully Furnished,"Barbeque area, Multipurpose hall, Lift, Parking, Security, Playground, Swimming Pool, Gymnasium, Jogging Track",,"Jalan Seri Wangsa 1, Taman Sri Rampai, Wangsa Maju, Kuala Lumpur",Kuala Lumpur,Wangsa Maju,2025-01-25 16:50,109925153,3.1931270823436493,101.73537431671753
"RM 4,300 per month","Apartment / Condominium, For rent",Service Residence,3,4,1828 sq.ft.,Fully Furnished,"Security, Gymnasium, Jogging Track, Barbeque area, Multipurpose hall, Playground, Swimming Pool, Sauna",,"Jalan Laksamana 1, Off Persiaran Puteri Selatan, Iskandar Puteri, Johor",Johor,Iskandar Puteri,2025-01-25 16:50,109925173,,
"RM 3,600 per month","Apartment / Condominium, For rent",Condominium,4,3,1227 sq.ft.,Fully Furnished,"Barbeque area, Multipurpose hall, Lift, Parking, Security, Playground, Swimming Pool, Gymnasium, Jogging Track",,"Jalan Seri Wangsa 1, Taman Sri Rampai, Wangsa Maju, Kuala Lumpur",Kuala Lumpur,Wangsa Maju,2025-01-25 16:50,109925172,3.1931270823436493,101.73537431671753
"RM 2,600 per month","House, For rent",2-storey Terraced House,5,3,2200 sq.ft.,Partially Furnished,,,,Selangor,Kajang,2025-01-25 16:49,109822828,,
"RM 2,000 per month","Apartment / Condominium, For rent",Apartment,2,2,972 sq.ft.,Partially Furnished,"Multipurpose hall, Security, Playground, Gymnasium, Parking, Swimming Pool, Squash Court",,"Jalan Idaman 9, Off Jalan Ceria, Nusa Idaman, Iskandar Puteri, Johor",Johor,Iskandar Puteri,2025-01-25 16:48,109925248,,
"RM 2,100 per month","Apartment / Condominium, For rent",Service Residence,1,1,250 sq.ft.,Fully Furnished,"Playground, Swimming Pool, Security, Parking, Barbeque area, Multipurpose hall, Gymnasium, Sauna, Lift","Air-Cond, Cooking Allowed, Washing Machine","Jalan Berhala, Off Jalan Sultan Abdul Samad, Brickfields, Kuala Lumpur",Kuala Lumpur,Brickfields,2025-01-25 16:48,109779202,,
"RM 4,000 per month","Apartment / Condominium, For rent",Condominium,5,4,1977 sq.ft.,Fully Furnished,"Minimart, Gymnasium, Barbeque area, Swimming Pool, Tennis Court, Sauna, Security, Playground, Squash Court, Parking, Lift, Multipurpose hall, Club house, Jogging Track","Air-Cond, Cooking Allowed, Near KTM/LRT, Washing Machine, Internet","No.11, Jalan Duta Kiara, Mont Kiara, Kuala Lumpur",Kuala Lumpur,Mont Kiara,2025-01-25 16:47,109925233,3.1738667456717766,101.66035546129001
"RM 1,800 per month","Apartment / Condominium, For rent",Condominium,3,2,800 sq.ft.,Fully Furnished,"Security, Playground, Parking, Lift, Gymnasium, Multipurpose hall, Swimming Pool",,"Cangkat Sungai Ara 6A, Sungai Ara, Penang",Penang,Sungai Ara,2025-01-25 16:46,109925225,5.335574895085697,100.26577146839158
"RM 1,200 per month","Apartment / Condominium, For rent",Service Residence,2,2,720 sq.ft.,Partially Furnished,"Parking, Security, Lift, Swimming Pool, Playground, Gymnasium, Sauna, Barbeque area","Air-Cond, Cooking Allowed, Near KTM/LRT, Washing Machine","Jalan Raya 2, Taman Serdang Jaya, Seri Kembangan, Selangor",Selangor,Seri Kembangan,2025-01-25 16:46,109925224,3.01809905,101.70502382577979
"RM 1,200 per month","Apartment / Condominium, For rent",Flat,2,1,700 sq.ft.,Partially Furnished,Minimart,,"Lebuh Nangka 2, Taman Desa Damai, Bukit Mertajam, Penang",Penang,Bukit Mertajam,2025-01-25 16:46,109925222,5.363764990911463,100.44350414961475
"RM 2,500 per month","Apartment / Condominium, For rent",Service Residence,2,2,865 sq.ft.,Fully Furnished,"Parking, Security, Lift, Swimming Pool, Playground, Gymnasium, Sauna, Barbeque area, Minimart, Multipurpose hall, Club house, Jogging Track","Air-Cond, Cooking Allowed, Near KTM/LRT, Washing Machine","Jalan Pudu Perdana, Taman Pudu Ulu, Cheras, Kuala Lumpur",Kuala Lumpur,Cheras,2025-01-25 16:45,109925221,,
"RM 15,000 per month","House, For rent",2-storey Terraced House,5,5,5500 sq.ft.,Partially Furnished,"Security, Swimming Pool","Air-Cond, Cooking Allowed, Washing Machine",,Sabah,Kota Kinabalu,2025-01-25 16:45,109925220,,
"RM 1,400 per month","Apartment / Condominium, For rent",Studio,1,1,1 sq.ft.,Fully Furnished,"Parking, Security, Minimart, Swimming Pool, Gymnasium, Lift, Barbeque area, Sauna",,"Jalan Tun Datuk Patinggi Hj. Ahmad Zaidi Adruce, Kuching, Sarawak",Sarawak,Kuching,2025-01-25 16:45,109925219,,
