monthly_rent,category_id,property_type,rooms,bathroom,size,furnished,facilities,additional_facilities,address,state,region,publishedDatetime,ads_id,latitude,longitude
"RM 1,800 per month","Apartment / Condominium, For rent",Service Residence,3,2,900 sq.ft.,Not Furnished,"Playground, Swimming Pool, Lift, Barbeque area, Parking, Gymnasium, Jogging Track, Security, Sauna, Tennis Court, Multipurpose hall, Minimart","Near KTM/LRT, Cooking Allowed","Jalan PJU 8/8, Damansara Perdana, Selangor",Selangor,Damansara Perdana,2025-01-25 14:48,109864967,3.1682125,101.61253124999999
"RM 1,800 per month","House, For rent",Semi-Detached House,3,2,1300 sq.ft.,Partially Furnished,"Parking, Playground, Minimart, Jogging Track","Air-Cond, Cooking Allowed",,Kuala Lumpur,Batu,2025-01-25 14:47,109924176,,
RM 800 per month,"Apartment / Condominium, For rent",Apartment,3,2,750 sq.ft.,Not Furnished,Parking,"Air-Cond, Cooking Allowed, Near KTM/LRT, Washing Machine, Internet","Jalan PJU 10/4c, Damansara Damai, Selangor",Selangor,Damansara Damai,2025-01-25 14:47,109924174,3.1934705965950347,101.58494434540214
"RM 1,000 per month","Apartment / Condominium, For rent",Apartment,3,2,1000 sq.ft.,Partially Furnished,,"Air-Cond, Cooking Allowed, Washing Machine","Jalan Melaka Raya 8, Taman Melaka Raya, Off Jalan Syed Abdul Aziz, Melaka City, Melaka",Melaka,Melaka City,2025-01-25 14:47,109924172,,
RM 850 per month,"House, For rent",2-storey Terraced House,2,2,900 sq.ft.,Fully Furnished,Parking,"Cooking Allowed, Washing Machine",,Sabah,Keningau,2025-01-25 14:47,109924171,,
RM 680 per month,"Apartment / Condominium, For rent",Apartment,3,2,650 sq.ft.,Partially Furnished,Minimart,,"Persiaran Botanik, Bandar Botanic, Port Klang, Selangor",Selangor,Port Klang,2025-01-25 14:47,109924166,,
"RM 1,500 per month","Apartment / Condominium, For rent",Condominium,3,2,850 sq.ft.,Partially Furnished,"Parking, Security, Lift, Swimming Pool, Playground, Barbeque area, Multipurpose hall",,"Jalan Duta Kiara, Segambut, Kuala Lumpur",Kuala Lumpur,Segambut,2025-01-25 14:47,109924165,3.174307888083121,101.66263919884254
RM 850 per month,"Apartment / Condominium, For rent",Flat,3,2,800 sq.ft.,Not Furnished,"Parking, Security, Lift, Playground","Cooking Allowed, Near KTM/LRT, Washing Machine","Jalan 2/54b, Kampung Baru Ayer Panas, Setapak, Kuala Lumpur",Kuala Lumpur,Setapak,2025-01-25 14:47,109924162,3.18996082673511,101.71383840236076
RM 450 per month,"House, For rent",2-storey Terraced House,3,2,1900 sq.ft.,Not Furnished,Parking,Air-Cond,,Terengganu,Kuala Terengganu,2025-01-25 14:47,109924157,,
RM 800 per month,"House, For rent",Others,3,2,1300 sq.ft.,Partially Furnished,,,,Negeri Sembilan,Seremban,2025-01-25 14:46,109924155,,
"RM 3,000 per month","Apartment / Condominium, For rent",Studio,1,1,649 sq.ft.,Fully Furnished,"Security, Swimming Pool, Playground, Gymnasium, Sauna, Multipurpose hall",,"Jalan Bersatu, Damai, Kota Kinabalu, Sabah",Sabah,Kota Kinabalu,2025-01-25 14:46,109924151,5.96684616568953,116.09667462063587
"RM 1,200 per month","House, For rent",Bungalow House,4,3,1450 sq.ft.,Not Furnished,Minimart,Air-Cond,,Kedah,Kulim,2025-01-25 14:46,109924150,,
"RM 3,500 per month","Apartment / Condominium, For rent",Condominium,3,3,1009 sq.ft.,Partially Furnished,"Parking, Security, Tennis Court, Lift, Swimming Pool, Playground, Gymnasium, Sauna, Barbeque area, Minimart, Multipurpose hall","Air-Cond, Cooking Allowed, Near KTM/LRT, Washing Machine","Jalan Cheras Hartamas, Cheras, Kuala Lumpur",Kuala Lumpur,Cheras,2025-01-25 14:46,109924144,3.0808800639873035,101.74622226947993
"RM 1,000 per month","House, For rent",2-storey Terraced House,4,3,1200 sq.ft.,Not Furnished,,,,Selangor,Bukit Beruntung,2025-01-25 14:45,109924142,,
"RM 2,250 per month","Apartment / Condominium, For rent",Condominium,3,2,1000 sq.ft.,Partially Furnished,"Playground, Swimming Pool, Gymnasium, Parking, Security, Club house",,"Off Jalan Lintas, Kota Kinabalu, Sabah",Sabah,Kota Kinabalu,2025-01-25 14:45,109924139,,
"RM 2,100 per month","House, For rent",2-storey Terraced House,4,3,1400 sq.ft.,Fully Furnished,Parking,"Air-Cond, Cooking Allowed, Washing Machine",,Penang,Bukit Tengah,2025-01-25 14:45,109924005,,
"RM 2,200 per month","House, For rent",2-storey Terraced House,4,3,2070 sq.ft.,Partially Furnished,,,,Selangor,Setia Alam,2025-01-25 14:45,109924000,,
"RM 1,700 per month","House, For rent",2-storey Terraced House,4,3,2070 sq.ft.,Partially Furnished,,,,Selangor,Setia Alam,2025-01-25 14:45,109923994,,
"RM 1,200 per month","House, For rent",1-storey Terraced House,3,1,1000 sq.ft.,Not Furnished,,Cooking Allowed,,Sarawak,Kota Samarahan,2025-01-25 14:45,109923983,,
"RM 3,399 per month","Apartment / Condominium, For rent",Service Residence,3,2,1283 sq.ft.,Fully Furnished,"Playground, Tennis Court, Barbeque area, Parking, Swimming Pool, Gymnasium, Security, Lift","Air-Cond, Cooking Allowed, Washing Machine","Jalan PJU 7/6, Mutiara Damansara, Selangor",Selangor,Mutiara Damansara,2025-01-25 14:45,109924009,3.1607451503884563,101.61410000809674
"RM 4,000 per month","Apartment / Condominium, For rent",Condominium,2,2,1000 sq.ft.,Fully Furnished,"Sauna, Multipurpose hall, Security, Gymnasium, Lift, Barbeque area, Parking, Playground, Swimming Pool","Air-Cond, Cooking Allowed, Washing Machine","Persiaran Bayan Indah 2, Bayan Lepas, Penang",Penang,Bayan Lepas,2025-01-25 14:45,109923996,5.337461530991244,100.30997834479288
"RM 15,000 per month","Apartment / Condominium, For rent",Townhouse Condo,6,5,6583 sq.ft.,Fully Furnished,"Parking, Security",,,Sabah,Kota Kinabalu,2025-01-25 14:45,109923969,,
"RM 1,000 per month","House, For rent",1-storey Terraced House,4,2,1195 sq.ft.,Partially Furnished,Parking,,,Melaka,Melaka City,2025-01-25 14:43,109858406,,
"RM 1,800 per month","Apartment / Condominium, For rent",Service Residence,1,1,650 sq.ft.,Partially Furnished,"Barbeque area, Parking, Swimming Pool, Lift, Security, Playground, Gymnasium, Squash Court, Multipurpose hall","Cooking Allowed, Near KTM/LRT, Washing Machine","Persiaran Subang Permai, USJ1, Subang Jaya, Selangor",Selangor,Subang Jaya,2025-01-25 14:43,109768275,,
"RM 1,500 per month","Apartment / Condominium, For rent",Apartment,3,2,937 sq.ft.,Not Furnished,"Jogging Track, Parking, Security, Minimart, Lift, Playground","Air-Cond, Cooking Allowed","Jalan SS 8/7, Kelana Jaya, Petaling Jaya, Selangor",Selangor,Petaling Jaya,2025-01-25 14:39,109871929,3.091524160387636,101.60307104490327
RM 850 per month,"Apartment / Condominium, For rent",Condominium,1,1,893 sq.ft.,Partially Furnished,"Playground, Parking, Security, Gymnasium, Barbeque area, Multipurpose hall, Swimming Pool, Jogging Track, Lift, Minimart","Cooking Allowed, Air-Cond","Off Jalan Semenyih, Semenyih, Selangor",Selangor,Semenyih,2025-01-25 14:39,102859177,2.936387445047508,101.8525682681381
"RM 1,000 per month","Apartment / Condominium, For rent",Apartment,3,2,900 sq.ft.,Not Furnished,"Playground, Gymnasium, Multipurpose hall, Parking, Security, Swimming Pool, Jogging Track, Lift",,"Jalan Lembah, Off Jalan Bukit Gambir, Gelugor, Penang",Penang,Gelugor,2025-01-25 14:36,109918122,,
RM 700 per month,"Apartment / Condominium, For rent",Apartment,3,2,850 sq.ft.,Not Furnished,"Parking, Playground, Squash Court","Air-Cond, Cooking Allowed, Near KTM/LRT","Off Lebuhraya SILK, Taman Bukit Mewah, Kajang, Selangor",Selangor,Kajang,2025-01-25 14:36,109924037,,
"RM 1,600 per month","House, For rent",2-storey Terraced House,4,3,1100 sq.ft.,Not Furnished,"Parking, Minimart",Near KTM/LRT,,Selangor,Klang,2025-01-25 14:36,109758398,,
RM 900 per month,"Apartment / Condominium, For rent",Flat,3,1,653 sq.ft.,Not Furnished,"Security, Parking, Playground",,"Jalan Langkawi, Taman Setapak, Setapak, Kuala Lumpur",Kuala Lumpur,Setapak,2025-01-25 14:35,109250404,3.207408603067701,101.71802242994046
"RM 3,500 per month","Apartment / Condominium, For rent",Service Residence,3,2,1357 sq.ft.,Partially Furnished,"Security, Multipurpose hall, Swimming Pool, Sauna, Playground, Gymnasium",,"Jalan Bersatu, Damai, Kota Kinabalu, Sabah",Sabah,Kota Kinabalu,2025-01-25 14:35,109923843,5.96684616568953,116.09667462063587
"RM 1,850 per month","Apartment / Condominium, For rent",Apartment,3,2,1020 sq.ft.,Fully Furnished,"Parking, Security, Swimming Pool, Lift, Multipurpose hall","Air-Cond, Cooking Allowed, Near KTM/LRT, Washing Machine, Internet","Jalan Pandan Utama, Pandan Indah, Ampang, Selangor",Selangor,Ampang,2025-01-25 14:35,109923842,3.1290159500000003,101.75274985
"RM 1,150 per month","Apartment / Condominium, For rent",Apartment,3,2,750 sq.ft.,Not Furnished,"Minimart, Jogging Track, Playground, Security, Barbeque area, Parking","Cooking Allowed, Near KTM/LRT","Persiaran Botanik, Bandar Botanic, Klang, Selangor",Selangor,Klang,2025-01-25 14:31,109723995,2.988147026397493,101.44714926424855
"RM 2,000 per month","House, For rent",Bungalow House,3,2,6650 sq.ft.,Partially Furnished,,,,Penang,Simpang Ampat,2025-01-25 14:31,109822811,,
"RM 2,200 per month","Apartment / Condominium, For rent",Condominium,4,3,1614 sq.ft.,Partially Furnished,"Lift, Parking, Security, Swimming Pool, Gymnasium, Sauna, Jogging Track, Playground",,"Jalan 6/38A, Taman Sri Sinar, Segambut, Kuala Lumpur",Kuala Lumpur,Segambut,2025-01-25 14:30,109629768,3.18721457935377,101.6549810953152
"RM 2,000 per month","House, For rent",2-storey Terraced House,4,4,2800 sq.ft.,Partially Furnished,,,,Selangor,Shah Alam,2025-01-25 14:29,109599688,,
"RM 1,800 per month","House, For rent",2-storey Terraced House,4,3,1400 sq.ft.,Partially Furnished,,,,Selangor,Bandar Bukit Tinggi,2025-01-25 14:29,109923894,,
"RM 3,300 per month","House, For rent",Bungalow House,4,3,3500 sq.ft.,Fully Furnished,,,,Labuan,Sungai Keling,2025-01-25 14:29,108827772,,
"RM 2,500 per month","Apartment / Condominium, For rent",Condominium,3,2,1044 sq.ft.,Not Furnished,"Parking, Security, Playground, Gymnasium, Swimming Pool, Lift","Air-Cond, Cooking Allowed","Persiaran Batu Uban 1, The Century, Gelugor, Penang",Penang,Gelugor,2025-01-25 14:27,108645212,,
"RM 1,300 per month","House, For rent",2-storey Terraced House,4,3,1400 sq.ft.,Partially Furnished,"Security, Playground","Air-Cond, Cooking Allowed, Washing Machine",,Kedah,Kuala Ketil,2025-01-25 14:27,108947956,,
"RM 4,200 per month","Apartment / Condominium, For rent",Condominium,2,2,1200 sq.ft.,Fully Furnished,"Lift, Barbeque area, Swimming Pool, Playground, Security, Sauna, Multipurpose hall, Parking, Gymnasium","Air-Cond, Cooking Allowed, Washing Machine","Persiaran Bayan Indah 2, Bayan Lepas, Penang",Penang,Bayan Lepas,2025-01-25 14:25,109716542,5.337461530991244,100.30997834479288
"RM 1,400 per month","Apartment / Condominium, For rent",Apartment,3,2,1000 sq.ft.,Not Furnished,"Parking, Security, Jogging Track, Barbeque area, Playground, Gymnasium, Swimming Pool, Lift",,"No.6, Jalan S.P. Chelliah, Taman Harapan, Georgetown, Penang",Penang,Georgetown,2025-01-25 14:25,108589007,,
"RM 7,900 per month","Apartment / Condominium, For rent",Condominium,3,2,1400 sq.ft.,Fully Furnished,"Sauna, Multipurpose hall, Security, Gymnasium, Lift, Barbeque area, Parking, Playground, Swimming Pool","Cooking Allowed, Air-Cond, Washing Machine","Persiaran Bayan Indah 2, Bayan Lepas, Penang",Penang,Bayan Lepas,2025-01-25 14:21,109923854,5.337461530991244,100.30997834479288
"RM 1,850 per month","House, For rent",1.5-storey Terraced House,4,3,1600 sq.ft.,Partially Furnished,"Parking, Playground","Air-Cond, Cooking Allowed",,Selangor,Selayang,2025-01-25 14:21,109923847,,
"RM 2,000 per month","Apartment / Condominium, For rent",Condominium,3,2,1155 sq.ft.,Fully Furnished,"Gymnasium, Security, Lift, Barbeque area, Multipurpose hall, Parking, Playground, Swimming Pool","Air-Cond, Cooking Allowed, Washing Machine","Gerbang Bukit Kecil 2, Bayan Lepas, Penang",Penang,Bayan Lepas,2025-01-25 14:21,108537450,5.3319411533847845,100.29795019766486
"RM 2,600 per month","House, For rent",2-storey Terraced House,3,3,1600 sq.ft.,Partially Furnished,"Parking, Barbeque area, Playground",,,Sabah,Kota Kinabalu,2025-01-25 14:20,109459315,,
"RM 1,500 per month","Apartment / Condominium, For rent",Apartment,3,2,700 sq.ft.,Fully Furnished,"Security, Barbeque area, Playground, Gymnasium, Parking, Jogging Track","Air-Cond, Cooking Allowed, Washing Machine","Jalan Van Praagh, Taman Continental,, Jelutong, Penang",Penang,Jelutong,2025-01-25 14:20,109184416,,
"RM 1,200 per month","Apartment / Condominium, For rent",Apartment,3,2,900 sq.ft.,Partially Furnished,"Parking, Security, Lift, Swimming Pool, Playground, Gymnasium, Barbeque area, Minimart",,"Jalan Silat Lincah, Bandar Selesa Jaya, Skudai, Johor",Johor,Skudai,2025-01-25 14:19,109923834,1.4925422143452214,103.63192657117516
RM 600 per month,"House, For rent",Townhouse,3,2,850 sq.ft.,Not Furnished,Parking,Cooking Allowed,,Melaka,Melaka Tengah,2025-01-25 14:19,109923828,,
RM 500 per month,"House, For rent",1-storey Terraced House,2,1,750 sq.ft.,Not Furnished,Parking,,,Melaka,Merlimau,2025-01-25 14:18,109923825,,
"RM 1,500 per month","House, For rent",2-storey Terraced House,4,3,1400 sq.ft.,Partially Furnished,"Parking, Jogging Track, Security, Tennis Court, Playground","Air-Cond, Cooking Allowed",,Selangor,Semenyih,2025-01-25 14:18,109923822,,
"RM 1,500 per month","Apartment / Condominium, For rent",Apartment,3,2,1037 sq.ft.,Partially Furnished,"Security, Parking, Swimming Pool, Playground, Barbeque area, Minimart, Multipurpose hall, Lift",Cooking Allowed,"Jalan Seri Putra 1 / 2, Bandar Seri Putra, Bangi, Selangor",Selangor,Bangi,2025-01-25 14:17,109536783,2.884265999539895,101.79118465123774
"RM 1,150 per month","Apartment / Condominium, For rent",Condominium,3,2,980 sq.ft.,Fully Furnished,"Parking, Security, Playground, Swimming Pool, Minimart, Gymnasium, Lift","Cooking Allowed, Air-Cond, Washing Machine","Jalan Cyberia 1, Off Persiaran Multimedia, Cyberjaya, Selangor",Selangor,Cyberjaya,2025-01-25 14:14,109315518,,
RM 850 per month,"Apartment / Condominium, For rent",Apartment,3,2,660 sq.ft.,Partially Furnished,"Minimart, Playground, Lift",Cooking Allowed,"Jalan Tropicana Selatan, Petaling Jaya, Selangor",Selangor,Petaling Jaya,2025-01-25 14:11,109442468,3.1337432965642447,101.59951498570241
"RM 1,250 per month","Apartment / Condominium, For rent",Condominium,3,2,1040 sq.ft.,Partially Furnished,"Security, Playground, Parking, Lift, Swimming Pool, Gymnasium, Multipurpose hall","Cooking Allowed, Air-Cond","Off Jalan Mutiara 2, Mutiara Heights, Kajang, Selangor",Selangor,Kajang,2025-01-25 14:11,109434542,,
RM 700 per month,"Apartment / Condominium, For rent",Apartment,3,2,780 sq.ft.,Partially Furnished,"Security, Parking, Playground",Cooking Allowed,"Taman Putra Perdana, 47100 Puchong, Selangor, Puchong, Selangor",Selangor,Puchong,2025-01-25 14:11,109486538,,
"RM 1,300 per month","Apartment / Condominium, For rent",Condominium,3,2,1150 sq.ft.,Partially Furnished,"Playground, Security, Swimming Pool, Squash Court, Parking, Tennis Court",,"Jalan Batu Unjur 9, Taman Bayu Perdana, Off Persiaran Pegaga, Klang, Selangor",Selangor,Klang,2025-01-25 14:10,109923389,,
"RM 2,000 per month","House, For rent",2-storey Terraced House,4,3,2000 sq.ft.,Not Furnished,"Parking, Playground","Air-Cond, Cooking Allowed",,Selangor,Selayang,2025-01-25 14:10,109923748,,
"RM 1,900 per month","Apartment / Condominium, For rent",Condominium,3,2,1200 sq.ft.,Fully Furnished,"Barbeque area, Parking, Swimming Pool, Gymnasium, Jogging Track, Multipurpose hall, Security, Playground","Air-Cond, Cooking Allowed, Washing Machine","Lintang Sungai Ara 14, Sungai Ara, Penang",Penang,Sungai Ara,2025-01-25 14:09,109923745,5.334168524300976,100.2729452755813
"RM 1,000 per month","House, For rent",Semi-Detached House,3,2,7200 sq.ft.,Not Furnished,,,,Kedah,Lunas,2025-01-25 14:06,109923706,,
"RM 1,499 per month","Apartment / Condominium, For rent",Apartment,3,2,800 sq.ft.,Partially Furnished,"Security, Parking, Playground, Multipurpose hall, Lift","Air-Cond, Near KTM/LRT","No. 1, Jalan 3/33A, Kepong Baru, Kepong, Kuala Lumpur",Kuala Lumpur,Kepong,2025-01-25 14:06,109923697,,
"RM 4,500 per month","House, For rent",Semi-Detached House,5,5,3600 sq.ft.,Partially Furnished,"Parking, Security, Playground, Minimart, Barbeque area","Cooking Allowed, Near KTM/LRT, Air-Cond, Washing Machine",,Selangor,Kajang,2025-01-25 14:05,109923686,,
"RM 1,499 per month","Apartment / Condominium, For rent",Apartment,3,2,800 sq.ft.,Partially Furnished,"Security, Parking, Playground, Multipurpose hall, Lift","Air-Cond, Near KTM/LRT","No. 1, Jalan 3/33A, Kepong Baru, Kepong, Kuala Lumpur",Kuala Lumpur,Kepong,2025-01-25 14:05,109923670,,
"RM 1,799 per month","Apartment / Condominium, For rent",Apartment,3,2,800 sq.ft.,Partially Furnished,"Security, Parking, Playground, Multipurpose hall, Lift","Air-Cond, Near KTM/LRT","No. 1, Jalan 3/33A, Kepong Baru, Kepong, Kuala Lumpur",Kuala Lumpur,Kepong,2025-01-25 14:05,109923656,,
"RM 1,400 per month","House, For rent",2-storey Terraced House,3,2,1200 sq.ft.,Partially Furnished,,,,Selangor,Shah Alam,2025-01-25 14:05,109923322,,
"RM 1,700 per month","Apartment / Condominium, For rent",Service Residence,2,2,700 sq.ft.,Fully Furnished,"Gymnasium, Sauna, Multipurpose hall, Parking, Security, Playground, Swimming Pool, Lift, Barbeque area, Jogging Track","Air-Cond, Cooking Allowed, Washing Machine","Jalan Desa Bakti, Off Taman Desa, Taman Desa, Kuala Lumpur",Kuala Lumpur,Taman Desa,2025-01-25 14:03,109923633,,
"RM 1,200 per month","House, For rent",2-storey Terraced House,4,3,1400 sq.ft.,Partially Furnished,"Parking, Playground",Air-Cond,,Perak,Sitiawan,2025-01-25 14:03,109923617,,
"RM 2,500 per month","House, For rent",2-storey Terraced House,4,3,1920 sq.ft.,Partially Furnished,Parking,Cooking Allowed,,Johor,Johor Bahru,2025-01-25 14:03,109923611,,
"RM 2,099 per month","Apartment / Condominium, For rent",Service Residence,1,1,560 sq.ft.,Fully Furnished,"Security, Minimart, Lift, Sauna, Multipurpose hall, Jogging Track, Parking, Swimming Pool, Playground, Gymnasium, Tennis Court","Air-Cond, Cooking Allowed, Washing Machine","Jalan Bemban, Ampang, Selangor",Selangor,Ampang,2025-01-25 14:02,109660045,,
"RM 2,350 per month","Apartment / Condominium, For rent",Service Residence,4,3,1380 sq.ft.,Fully Furnished,"Playground, Parking, Barbeque area, Security, Sauna, Multipurpose hall, Swimming Pool, Jogging Track, Gymnasium, Lift, Minimart","Air-Cond, Cooking Allowed, Washing Machine","Jalan Delima 3/1, Off Jalan Daya, Taman Delima, Johor Bahru, Johor",Johor,Johor Bahru,2025-01-25 14:01,109218078,,
"RM 1,800 per month","Apartment / Condominium, For rent",Condominium,3,2,900 sq.ft.,Fully Furnished,"Parking, Security, Lift, Playground, Swimming Pool, Barbeque area, Multipurpose hall, Jogging Track, Minimart","Cooking Allowed, Near KTM/LRT, Air-Cond, Washing Machine",,Kuala Lumpur,Mont Kiara,2025-01-25 13:59,109327290,,
"RM 1,800 per month","Apartment / Condominium, For rent",Condominium,3,2,1000 sq.ft.,Fully Furnished,"Parking, Security, Lift, Playground, Swimming Pool, Jogging Track, Gymnasium, Minimart","Air-Cond, Cooking Allowed, Washing Machine, Near KTM/LRT",,Kuala Lumpur,Sentul,2025-01-25 13:59,109851582,,
"RM 1,700 per month","House, For rent",Terraced House,3,3,1650 sq.ft.,Partially Furnished,Parking,"Cooking Allowed, Near KTM/LRT, Air-Cond",,Selangor,Putra Heights,2025-01-25 13:59,109912385,,
"RM 1,800 per month","Apartment / Condominium, For rent",Condominium,3,2,950 sq.ft.,Partially Furnished,"Parking, Security, Lift, Swimming Pool, Playground, Gymnasium, Sauna, Barbeque area, Minimart, Multipurpose hall, Club house, Jogging Track, Tennis Court, Squash Court","Air-Cond, Cooking Allowed, Near KTM/LRT, Washing Machine, Internet","Jalan Jujur, Bandar Tun Razak, Cheras, Kuala Lumpur",Kuala Lumpur,Cheras,2025-01-25 13:59,109430237,3.0879394,101.7204414
"RM 2,000 per month","Apartment / Condominium, For rent",Condominium,4,2,1350 sq.ft.,Fully Furnished,"Security, Parking, Sauna, Gymnasium, Lift, Swimming Pool",,"Lorong 2C, Off Jalan Abdul Samad, Johor Bahru, Johor",Johor,Johor Bahru,2025-01-25 13:53,109923318,,
"RM 1,000 per month","House, For rent",Townhouse,3,2,1400 sq.ft.,Partially Furnished,"Parking, Playground, Minimart",,,Johor,Kulai,2025-01-25 13:53,109923315,,
RM 700 per month,"House, For rent",1-storey Terraced House,3,2,120 sq.ft.,Partially Furnished,"Parking, Jogging Track, Playground, Minimart","Cooking Allowed, Internet",,Perak,Tronoh,2025-01-25 13:52,109923311,,
"RM 1,500 per month","House, For rent",2-storey Terraced House,3,3,1400 sq.ft.,Fully Furnished,"Parking, Playground, Jogging Track",Washing Machine,,Kedah,Kulim,2025-01-25 13:52,109923309,,
RM 650 per month,"House, For rent",Terraced House,3,1,940 sq.ft.,Not Furnished,"Parking, Playground, Jogging Track",Cooking Allowed,,Kedah,Alor Setar,2025-01-25 13:52,109923298,,
"RM 2,200 per month","Apartment / Condominium, For rent",Condominium,3,2,1450 sq.ft.,Fully Furnished,"Parking, Gymnasium, Sauna, Swimming Pool, Multipurpose hall, Security, Lift, Playground, Club house","Air-Cond, Cooking Allowed, Washing Machine","Jalan Mayang Pasir 2, Elite Avenue, Bayan Lepas, Penang",Penang,Bayan Lepas,2025-01-25 13:51,109923297,,
RM 800 per month,"Apartment / Condominium, For rent",Flat,3,2,850 sq.ft.,Not Furnished,Parking,,"Jalan Titiwangsa 17/5, Taman Tampoi Utama, Tampoi, Johor Bahru, Johor",Johor,Johor Bahru,2025-01-25 13:51,109923295,1.5146575503108537,103.68140656511106
"RM 1,500 per month","House, For rent",2-storey Terraced House,4,3,1500 sq.ft.,Not Furnished,"Parking, Security",Cooking Allowed,,Selangor,Klang,2025-01-25 13:51,109782620,,
"RM 1,350 per month","Apartment / Condominium, For rent",Condominium,3,2,850 sq.ft.,Partially Furnished,"Security, Playground, Swimming Pool, Parking, Lift, Multipurpose hall, Minimart","Cooking Allowed, Air-Cond","Persiaran Sepang, Cyber 11, Cyberjaya, Selangor",Selangor,Cyberjaya,2025-01-25 13:51,109734649,2.9281982233063415,101.63341053956523
"RM 1,250 per month","Apartment / Condominium, For rent",Condominium,3,2,1004 sq.ft.,Fully Furnished,"Swimming Pool, Squash Court, Security, Playground, Jogging Track, Barbeque area, Parking, Multipurpose hall, Lift, Gymnasium","Cooking Allowed, Washing Machine, Air-Cond","Jalan SP7, Off Jalan Saujana Putra, Bandar Saujana Putra, Selangor",Selangor,Bandar Saujana Putra,2025-01-25 13:51,109589919,,
"RM 1,050 per month","Apartment / Condominium, For rent",Apartment,3,2,800 sq.ft.,Partially Furnished,"Playground, Lift, Parking, Security","Cooking Allowed, Air-Cond","No 6, Persiaran Setia Makmur, Seksyen U13, Setia Alam, Selangor",Selangor,Setia Alam,2025-01-25 13:51,109541915,3.134422519262327,101.47590430085808
"RM 1,050 per month","Apartment / Condominium, For rent",Apartment,3,2,850 sq.ft.,Partially Furnished,"Playground, Parking, Swimming Pool, Security, Lift",Cooking Allowed,"Persiaran Puncak Jalil 2, Taman Puncak Jalil, Seri Kembangan, Selangor",Selangor,Seri Kembangan,2025-01-25 13:51,109442820,3.0263145662717537,101.68032080367745
RM 600 per month,"Apartment / Condominium, For rent",Apartment,3,2,650 sq.ft.,Not Furnished,"Playground, Security",Cooking Allowed,,Selangor,Bangi,2025-01-25 13:51,109434545,,
RM 950 per month,"Apartment / Condominium, For rent",Condominium,3,2,950 sq.ft.,Partially Furnished,"Parking, Security, Minimart, Playground, Lift","Cooking Allowed, Near KTM/LRT, Washing Machine, Air-Cond","Sungai Besi Serdang Perdana, Taman Serdang Perdana, Seri Kembangan, Selangor",Selangor,Seri Kembangan,2025-01-25 13:51,109427476,,
"RM 1,250 per month","Apartment / Condominium, For rent",Apartment,3,2,850 sq.ft.,Partially Furnished,"Playground, Parking, Security, Lift, Swimming Pool, Gymnasium","Cooking Allowed, Near KTM/LRT","Jalan Wawasan 2/3, Puchong, Selangor",Selangor,Puchong,2025-01-25 13:50,107858465,3.029953058575465,101.61974468924471
"RM 3,000 per month","House, For rent",2-storey Terraced House,5,5,3229 sq.ft.,Partially Furnished,"Parking, Security, Playground",,,Selangor,Setia Alam,2025-01-25 13:50,109923289,,
"RM 2,200 per month","House, For rent",2-storey Terraced House,4,3,1400 sq.ft.,Partially Furnished,,,,Johor,Johor Bahru,2025-01-25 13:50,109923206,,
"RM 2,000 per month","Apartment / Condominium, For rent",Service Residence,1,1,450 sq.ft.,Fully Furnished,"Gymnasium, Playground, Parking, Minimart, Jogging Track, Barbeque area, Multipurpose hall, Security, Swimming Pool, Lift, Tennis Court, Squash Court, Sauna, Club house","Air-Cond, Cooking Allowed, Washing Machine","Lorong Masjid 1, Kampung Sungai Kayu Ara, Petaling Jaya, Selangor",Selangor,Petaling Jaya,2025-01-25 13:50,109923209,3.136534071795246,101.61430211315547
"RM 2,400 per month","Apartment / Condominium, For rent",Service Residence,1,1,533 sq.ft.,Fully Furnished,"Parking, Swimming Pool, Barbeque area, Sauna, Security, Playground, Gymnasium, Minimart, Lift",,"Jalan Selandang Off Jalan Dato Sulaiman, KSL City, Taman Abad, Johor Bahru, Johor",Johor,Johor Bahru,2025-01-25 13:50,109923200,,
"RM 2,000 per month","Apartment / Condominium, For rent",Service Residence,2,1,590 sq.ft.,Fully Furnished,"Parking, Security, Lift, Swimming Pool, Playground, Gymnasium, Sauna, Barbeque area, Minimart, Multipurpose hall, Club house, Jogging Track, Tennis Court, Squash Court",,"Jalan Sultanah Aminah, Marina Cove, Johor Bahru, Johor",Johor,Johor Bahru,2025-01-25 13:50,109858171,,
"RM 1,200 per month","Apartment / Condominium, For rent",Apartment,3,2,900 sq.ft.,Partially Furnished,"Security, Parking",Cooking Allowed,"Jalan 5/76a, Off Jalan Kampung Pandan, Desa Pandan, Kuala Lumpur",Kuala Lumpur,Desa Pandan,2025-01-25 13:49,109923284,,
